<?xml version="1.0" encoding="utf-8"?>
<!-- ===================================================================== -->
<!--
 * This file is part of CARDAMOM (R) which is jointly developed by THALES
 * and SELEX-SI. It is derivative work based on PERCO Copyright (C) THALES
 * 2000-2003. All rights reserved.
 * 
 * Copyright (C) THALES 2004-2005. All rights reserved
 * 
 * CARDAMOM is free software; you can redistribute it and/or modify it
 * under the terms of the GNU Library General Public License as published
 * by the Free Software Foundation; either version 2 of the License, or
 * (at your option) any later version.
 * 
 * CARDAMOM is distributed in the hope that it will be useful, but WITHOUT
 * ANY WARRANTY; without even the implied warranty of MERCHANTABILITY or
 * FITNESS FOR A PARTICULAR PURPOSE. See the GNU Library General Public
 * License for more details.
 * 
 * You should have received a copy of the GNU Library General Public
 * License along with CARDAMOM; see the file COPYING. If not, write to the
 * Free Software Foundation, Inc., 675 Mass Ave, Cambridge, MA 02139, USA.
-->
<!-- ===================================================================== -->

<!DOCTYPE process SYSTEM "CdmwSystemMngtDatastore_Desc.dtd">

<process>
    <services>
        <fault-tolerance request-duration-policy="50000" client-id="FTSystemMngt">
            <datastores max-transaction-in-progress="10" 
                max-transaction-done="20" 
                cohort-timeout="4000"
                coordinator-timeout="4000"
                number-of-scheduler-thread="5"
                chunk-size="200"
                freeze-size="150"
                freeze-timeout="500">
                <ManagedElementDataStore.datastore datastore-id="1"/>
                <SystemDataStore.datastore datastore-id="2"/>
                <HostDataStore.datastore datastore-id="3"/>
                <ApplicationDataStore.datastore datastore-id="4"/>
                <ProcessDataStore.datastore datastore-id="5"/>
                <EntityDataStore.datastore datastore-id="6"/>
                <SystemObserverRegistrationDataStore.datastore datastore-id="7"/>
                <EventReportDataStore.datastore datastore-id="8"/>
                <EventNotifierDataStore.datastore datastore-id="9"/>
                <ServiceDefsDataStore.datastore datastore-id="10"/>
                <RunSetDataStore.datastore datastore-id="11"/>
            </datastores>
        </fault-tolerance>
    </services>
</process>
